title,link,description
Multiple Criss-Cross Deletion-Correcting Codes. (arXiv:2102.02727v1 [cs.IT]),http://arxiv.org/abs/2102.02727,"<p>This paper investigates the problem of correcting multiple criss-cross
deletions in arrays. More precisely, we study the unique recovery of $n \times
n$ arrays affected by any combination of $t_\mathrm{r}$ row and $t_\mathrm{c}$
column deletions such that $t_\mathrm{r} + t_\mathrm{c} = t$ for a given $t$.
We refer to these type of deletions as $t$-criss-cross deletions. We show that
a code capable of correcting $t$-criss-cross deletions has redundancy at least
$tn + t \log n - \log(t!)$. Then, we present an existential construction of a
code capable of correcting $t$-criss-cross deletions where its redundancy is
bounded from above by $tn + \mathcal{O}(t^2 \log^2 n)$. The main ingredients of
the presented code are systematic binary $t$-deletion correcting codes and
Gabidulin codes. The first ingredient helps locating the indices of the deleted
rows and columns, thus transforming the deletion-correction problem into an
erasure-correction problem which is then solved using the second ingredient.
</p>
"
Minimum-Complexity Failure Correction in Linear Arrays via Compressive Processing. (arXiv:2102.02728v1 [eess.SY]),http://arxiv.org/abs/2102.02728,"<p>Given an array with defective elements, failure correction (FC) aims at
finding a new set of weights for the working elements so that the properties of
the original pattern can be recovered. Unlike several FC techniques available
in the literature, which update all the working excitations, the
Minimum-Complexity Failure Correction (MCFC) problem is addressed in this
paper. By properly reformulating the FC problem, the minimum number of
corrections of the whole excitations of the array is determined by means of an
innovative Compressive Processing (CP) technique in order to afford a pattern
as close as possible to the original one (i.e., the array without failures).
Selected examples, from a wide set of numerical test cases, are discussed to
assess the effectiveness of the proposed approach as well as to compare its
performance with other competitive state-of-the-art techniques in terms of both
pattern features and number of corrections.
</p>
"
Adversarial Attacks and Defenses in Physiological Computing: A Systematic Review. (arXiv:2102.02729v1 [cs.LG]),http://arxiv.org/abs/2102.02729,"<p>Physiological computing uses human physiological data as system inputs in
real time. It includes, or significantly overlaps with, brain-computer
interfaces, affective computing, adaptive automation, health informatics, and
physiological signal based biometrics. Physiological computing increases the
communication bandwidth from the user to the computer, but is also subject to
various types of adversarial attacks, in which the attacker deliberately
manipulates the training and/or test examples to hijack the machine learning
algorithm output, leading to possibly user confusion, frustration, injury, or
even death. However, the vulnerability of physiological computing systems has
not been paid enough attention to, and there does not exist a comprehensive
review on adversarial attacks to it. This paper fills this gap, by providing a
systematic review on the main research areas of physiological computing,
different types of adversarial attacks and their applications to physiological
computing, and the corresponding defense strategies. We hope this review will
attract more research interests on the vulnerability of physiological computing
systems, and more importantly, defense strategies to make them more secure.
</p>
"
Feedback Capacity of Parallel ACGN Channels and Kalman Filter: Power Allocation with Feedback. (arXiv:2102.02730v1 [cs.IT]),http://arxiv.org/abs/2102.02730,"<p>In this paper, we relate the feedback capacity of parallel additive colored
Gaussian noise (ACGN) channels to a variant of the Kalman filter. By doing so,
we obtain lower bounds on the feedback capacity of such channels, as well as
the corresponding feedback (recursive) coding schemes, which are essentially
power allocation policies with feedback, to achieve the bounds. The results are
seen to reduce to existing lower bounds in the case of a single ACGN feedback
channel, whereas when it comes to parallel additive white Gaussian noise (AWGN)
channels with feedback, the recursive coding scheme reduces to a ""feedback
water-filling"" power allocation policy.
</p>
"
Computational identification of significant actors in paintings through symbols and attributes. (arXiv:2102.02732v1 [cs.CV]),http://arxiv.org/abs/2102.02732,"<p>The automatic analysis of fine art paintings presents a number of novel
technical challenges to artificial intelligence, computer vision, machine
learning, and knowledge representation quite distinct from those arising in the
analysis of traditional photographs. The most important difference is that many
realist paintings depict stories or episodes in order to convey a lesson,
moral, or meaning. One early step in automatic interpretation and extraction of
meaning in artworks is the identifications of figures (actors). In Christian
art, specifically, one must identify the actors in order to identify the
Biblical episode or story depicted, an important step in understanding the
artwork. We designed an automatic system based on deep convolutional neural
networks and simple knowledge database to identify saints throughout six
centuries of Christian art based in large part upon saints symbols or
attributes. Our work represents initial steps in the broad task of automatic
semantic interpretation of messages and meaning in fine art.
</p>
"
Deep learning-based synthetic-CT generation in radiotherapy and PET: a review. (arXiv:2102.02734v1 [physics.med-ph]),http://arxiv.org/abs/2102.02734,"<p>Recently, deep learning (DL)-based methods for the generation of synthetic
computed tomography (sCT) have received significant research attention as an
alternative to classical ones. We present here a systematic review of these
methods by grouping them into three categories, according to their clinical
applications: I) to replace CT in magnetic resonance (MR)-based treatment
planning, II) facilitate cone-beam computed tomography (CBCT)-based
image-guided adaptive radiotherapy, and III) derive attenuation maps for the
correction of Positron Emission Tomography (PET). Appropriate database
searching was performed on journal articles published between January 2014 and
December 2020. The DL methods' key characteristics were extracted from each
eligible study, and a comprehensive comparison among network architectures and
metrics was reported. A detailed review of each category was given,
highlighting essential contributions, identifying specific challenges, and
summarising the achievements. Lastly, the statistics of all the cited works
from various aspects were analysed, revealing the popularity and future trends,
and the potential of DL-based sCT generation. The current status of DL-based
sCT generation was evaluated, assessing the clinical readiness of the presented
methods.
</p>
"
Hawkes Processes on Graphons. (arXiv:2102.02741v1 [cs.LG]),http://arxiv.org/abs/2102.02741,"<p>We propose a novel framework for modeling multiple multivariate point
processes, each with heterogeneous event types that share an underlying space
and obey the same generative mechanism. Focusing on Hawkes processes and their
variants that are associated with Granger causality graphs, our model leverages
an uncountable event type space and samples the graphs with different sizes
from a nonparametric model called {\it graphon}. Given those graphs, we can
generate the corresponding Hawkes processes and simulate event sequences.
Learning this graphon-based Hawkes process model helps to 1) infer the
underlying relations shared by different Hawkes processes; and 2) simulate
event sequences with different event types but similar dynamics. We learn the
proposed model by minimizing the hierarchical optimal transport distance
between the generated event sequences and the observed ones, leading to a novel
reward-augmented maximum likelihood estimation method. We analyze the
properties of our model in-depth and demonstrate its rationality and
effectiveness in both theory and experiments.
</p>
"
Sovereign Smartphone: To Enjoy Freedom We Have to Control Our Phones. (arXiv:2102.02743v1 [cs.CR]),http://arxiv.org/abs/2102.02743,"<p>The majority of smartphones either run iOS or Android operating systems. This
has created two distinct ecosystems largely controlled by Apple and Google -
they dictate which applications can run, how they run, and what kind of phone
resources they can access. Barring some exceptions in Android where different
phone manufacturers may have influence, users, developers, and governments are
left with little to no choice. Specifically, users need to entrust their
security and privacy to OS vendors and accept the functionality constraints
they impose. Given the wide use of Android and iOS, immediately leaving these
ecosystems is not practical, except in niche application areas. In this work,
we draw attention to the magnitude of this problem and why it is an undesirable
situation. As an alternative, we advocate the development of a new smartphone
architecture that securely transfers the control back to the users while
maintaining compatibility with the rich existing smartphone ecosystems. We
propose and analyze one such design based on advances in trusted execution
environments for ARM and RISC-V.
</p>
"
Semi-Supervised Action Recognition with Temporal Contrastive Learning. (arXiv:2102.02751v1 [cs.CV]),http://arxiv.org/abs/2102.02751,"<p>Learning to recognize actions from only a handful of labeled videos is a
challenging problem due to the scarcity of tediously collected activity labels.
We approach this problem by learning a two-pathway temporal contrastive model
using unlabeled videos at two different speeds leveraging the fact that
changing video speed does not change an action. Specifically, we propose to
maximize the similarity between encoded representations of the same video at
two different speeds as well as minimize the similarity between different
videos played at different speeds. This way we use the rich supervisory
information in terms of 'time' that is present in otherwise unsupervised pool
of videos. With this simple yet effective strategy of manipulating video
playback rates, we considerably outperform video extensions of sophisticated
state-of-the-art semi-supervised image recognition methods across multiple
diverse benchmark datasets and network architectures. Interestingly, our
proposed approach benefits from out-of-domain unlabeled videos showing
generalization and robustness. We also perform rigorous ablations and analysis
to validate our approach.
</p>
"
Materializing Knowledge Bases via Trigger Graphs. (arXiv:2102.02753v1 [cs.DB]),http://arxiv.org/abs/2102.02753,"<p>The chase is a well-established family of algorithms used to materialize
Knowledge Bases (KBs), like Knowledge Graphs (KGs), to tackle important tasks
like query answering under dependencies or data cleaning. A general problem of
chase algorithms is that they might perform redundant computations. To counter
this problem, we introduce the notion of Trigger Graphs (TGs), which guide the
execution of the rules avoiding redundant computations. We present the results
of an extensive theoretical and empirical study that seeks to answer when and
how TGs can be computed and what are the benefits of TGs when applied over
real-world KBs. Our results include introducing algorithms that compute
(minimal) TGs. We implemented our approach in a new engine, and our experiments
show that it can be significantly more efficient than the chase enabling us to
materialize KBs with 17B facts in less than 40 min on commodity machines.
</p>
"
Only a Matter of Style: Age Transformation Using a Style-Based Regression Model. (arXiv:2102.02754v1 [cs.CV]),http://arxiv.org/abs/2102.02754,"<p>The task of age transformation illustrates the change of an individual's
appearance over time. Accurately modeling this complex transformation over an
input facial image is extremely challenging as it requires making convincing
and possibly large changes to facial features and head shape, while still
preserving the input identity. In this work, we present an image-to-image
translation method that learns to directly encode real facial images into the
latent space of a pre-trained unconditional GAN (e.g., StyleGAN) subject to a
given aging shift. We employ a pre-trained age regression network used to
explicitly guide the encoder in generating the latent codes corresponding to
the desired age. In this formulation, our method approaches the continuous
aging process as a regression task between the input age and desired target
age, providing fine-grained control over the generated image. Moreover, unlike
other approaches that operate solely in the latent space using a prior on the
path controlling age, our method learns a more disentangled, non-linear path.
Finally, we demonstrate that the end-to-end nature of our approach, coupled
with the rich semantic latent space of StyleGAN, allows for further editing of
the generated images. Qualitative and quantitative evaluations show the
advantages of our method compared to state-of-the-art approaches.
</p>
"
Instance-based learning using the Half-Space Proximal Graph. (arXiv:2102.02755v1 [cs.LG]),http://arxiv.org/abs/2102.02755,"<p>The primary example of instance-based learning is the $k$-nearest neighbor
rule (kNN), praised for its simplicity and the capacity to adapt to new unseen
data and toss away old data. The main disadvantages often mentioned are the
classification complexity, which is $O(n)$, and the estimation of the parameter
$k$, the number of nearest neighbors to be used. The use of indexes at
classification time lifts the former disadvantage, while there is no conclusive
method for the latter.
</p>
<p>This paper presents a parameter-free instance-based learning algorithm using
the {\em Half-Space Proximal} (HSP) graph. The HSP neighbors simultaneously
possess proximity and variety concerning the center node. To classify a given
query, we compute its HSP neighbors and apply a simple majority rule over them.
In our experiments, the resulting classifier bettered $KNN$ for any $k$ in a
battery of datasets. This improvement sticks even when applying weighted
majority rules to both kNN and HSP classifiers.
</p>
<p>Surprisingly, when using a probabilistic index to approximate the HSP graph
and consequently speeding-up the classification task, our method could {\em
improve} its accuracy in stark contrast with the kNN classifier, which worsens
with a probabilistic index.
</p>
"
On the computational and statistical complexity of over-parameterized matrix sensing. (arXiv:2102.02756v1 [cs.LG]),http://arxiv.org/abs/2102.02756,"<p>We consider solving the low rank matrix sensing problem with Factorized
Gradient Descend (FGD) method when the true rank is unknown and over-specified,
which we refer to as over-parameterized matrix sensing. If the ground truth
signal $\mathbf{X}^* \in \mathbb{R}^{d*d}$ is of rank $r$, but we try to
recover it using $\mathbf{F} \mathbf{F}^\top$ where $\mathbf{F} \in
\mathbb{R}^{d*k}$ and $k&gt;r$, the existing statistical analysis falls short, due
to a flat local curvature of the loss function around the global maxima. By
decomposing the factorized matrix $\mathbf{F}$ into separate column spaces to
capture the effect of extra ranks, we show that $\|\mathbf{F}_t \mathbf{F}_t -
\mathbf{X}^*\|_{F}^2$ converges to a statistical error of $\tilde{\mathcal{O}}
({k d \sigma^2/n})$ after
$\tilde{\mathcal{O}}(\frac{\sigma_{r}}{\sigma}\sqrt{\frac{n}{d}})$ number of
iterations where $\mathbf{F}_t$ is the output of FGD after $t$ iterations,
$\sigma^2$ is the variance of the observation noise, $\sigma_{r}$ is the $r$-th
largest eigenvalue of $\mathbf{X}^*$, and $n$ is the number of sample. Our
results, therefore, offer a comprehensive picture of the statistical and
computational complexity of FGD for the over-parameterized matrix sensing
problem.
</p>
"
A 5 \mu W Standard Cell Memory-based Configurable Hyperdimensional Computing Accelerator for Always-on Smart Sensing. (arXiv:2102.02758v1 [eess.SP]),http://arxiv.org/abs/2102.02758,"<p>Hyperdimensional computing (HDC) is a brain-inspired computing paradigm based
on high-dimensional holistic representations of vectors. It recently gained
attention for embedded smart sensing due to its inherent error-resiliency and
suitability to highly parallel hardware implementations. In this work, we
propose a programmable all-digital CMOS implementation of a fully autonomous
HDC accelerator for always-on classification in energy-constrained sensor
nodes. By using energy-efficient standard cell memory (SCM), the design is
easily cross-technology mappable. It achieves extremely low power, 5 $\mu W$ in
typical applications, and an energy-efficiency improvement over the
state-of-the-art (SoA) digital architectures of up to 3$\times$ in post-layout
simulations for always-on wearable tasks such as EMG gesture recognition. As
part of the accelerator's architecture, we introduce novel hardware-friendly
embodiments of common HDC-algorithmic primitives, which results in 3.3$\times$
technology scaled area reduction over the SoA, achieving the same accuracy
levels in all examined targets. The proposed architecture also has a fully
configurable datapath using microcode optimized for HDC stored on an integrated
SCM based configuration memory, making the design ""general-purpose"" in terms of
HDC algorithm flexibility. This flexibility allows usage of the accelerator
across novel HDC tasks, for instance, a newly designed HDC applied to the task
of ball bearing fault detection.
</p>
"
Online Discrepancy Minimization via Persistent Self-Balancing Walks. (arXiv:2102.02765v1 [cs.DS]),http://arxiv.org/abs/2102.02765,"<p>We study the online discrepancy minimization problem for vectors in
$\mathbb{R}^d$ in the oblivious setting where an adversary is allowed fix the
vectors $x_1, x_2, \ldots, x_n$ in arbitrary order ahead of time. We give an
algorithm that maintains $O(\sqrt{\log(nd/\delta)})$ discrepancy with
probability $1-\delta$, matching the lower bound given in [Bansal et al. 2020]
up to an $O(\sqrt{\log \log n})$ factor in the high-probability regime. We also
provide results for the weighted and multi-color versions of the problem.
</p>
"
Designing an Encoder for StyleGAN Image Manipulation. (arXiv:2102.02766v1 [cs.CV]),http://arxiv.org/abs/2102.02766,"<p>Recently, there has been a surge of diverse methods for performing image
editing by employing pre-trained unconditional generators. Applying these
methods on real images, however, remains a challenge, as it necessarily
requires the inversion of the images into their latent space. To successfully
invert a real image, one needs to find a latent code that reconstructs the
input image accurately, and more importantly, allows for its meaningful
manipulation. In this paper, we carefully study the latent space of StyleGAN,
the state-of-the-art unconditional generator. We identify and analyze the
existence of a distortion-editability tradeoff and a distortion-perception
tradeoff within the StyleGAN latent space. We then suggest two principles for
designing encoders in a manner that allows one to control the proximity of the
inversions to regions that StyleGAN was originally trained on. We present an
encoder based on our two principles that is specifically designed for
facilitating editing on real images by balancing these tradeoffs. By evaluating
its performance qualitatively and quantitatively on numerous challenging
domains, including cars and horses, we show that our inversion method, followed
by common editing techniques, achieves superior real-image editing quality,
with only a small reconstruction accuracy drop.
</p>
"
PHASER: a Robust and Correspondence-free Global Pointcloud Registration. (arXiv:2102.02767v1 [cs.RO]),http://arxiv.org/abs/2102.02767,"<p>We propose PHASER, a correspondence-free global registration of
sensor-centric pointclouds that is robust to noise, sparsity, and partial
overlaps. Our method can seamlessly handle multimodal information and does not
rely on keypoint nor descriptor preprocessing modules. By exploiting properties
of Fourier analysis, PHASER operates directly on the sensor's signal, fusing
the spectra of multiple channels and computing the 6-DoF transformation based
on correlation. Our registration pipeline starts by finding the most likely
rotation followed by computing the most likely translation. Both estimates are
distributed according to a probability distribution that takes the underlying
manifold into account, i.e., a Bingham and Gaussian distribution, respectively.
This further allows our approach to consider the periodic-nature of rotations
and naturally represent its uncertainty. We extensively compare PHASER against
several well-known registration algorithms on both simulated datasets, and
real-world data acquired using different sensor configurations. Our results
show that PHASER can globally align pointclouds in less than 100ms with an
average accuracy of 2cm and 0.5deg, is resilient against noise, and can handle
partial overlap.
</p>
"
A survey on modelling of infectious disease spread and control on social contact networks. (arXiv:2102.02768v1 [physics.soc-ph]),http://arxiv.org/abs/2102.02768,"<p>Infectious diseases are a significant threat to human society which was over
sighted before the incidence of COVID-19, although according to the report of
the World Health Organisation (WHO) about 4.2 million people die annually due
to infectious disease. Due to recent COVID-19 pandemic, more than 2 million
people died during 2020 and 96.2 million people got affected by this
devastating disease. Recent research shows that applying individual
interactions and movements data could help managing the pandemic though
modelling the spread of infectious diseases on social contact networks.
Infectious disease spreading can be explained with the theories and methods of
diffusion processes where a dynamic phenomena evolves on networked systems. In
the modelling of diffusion process, it is assumed that contagious items spread
out in the networked system through the inter-node interactions. This resembles
spreading of infectious virus, e.g. spread of COVID-19, within a population
through individual social interactions. The evolution behaviours of the
diffusion process are strongly influenced by the characteristics of the
underlying system and the mechanism of the diffusion process itself. Thus,
spreading of infectious disease can be explained how people interact with each
other and by the characteristics of the disease itself. This paper presenters
the relevant theories and methodologies of diffusion process that can be used
to model the spread of infectious diseases.
</p>
"
A Living Review of Machine Learning for Particle Physics. (arXiv:2102.02770v1 [hep-ph]),http://arxiv.org/abs/2102.02770,"<p>Modern machine learning techniques, including deep learning, are rapidly
being applied, adapted, and developed for high energy physics. Given the fast
pace of this research, we have created a living review with the goal of
providing a nearly comprehensive list of citations for those developing and
applying these approaches to experimental, phenomenological, or theoretical
analyses. As a living document, it will be updated as often as possible to
incorporate the latest developments. A list of proper (unchanging) reviews can
be found within. Papers are grouped into a small set of topics to be as useful
as possible. Suggestions and contributions are most welcome, and we provide
instructions for participating.
</p>
"
Mask guided attention for fine-grained patchy image classification. (arXiv:2102.02771v1 [cs.CV]),http://arxiv.org/abs/2102.02771,"<p>In this work, we present a novel mask guided attention (MGA) method for
fine-grained patchy image classification. The key challenge of fine-grained
patchy image classification lies in two folds, ultra-fine-grained
inter-category variances among objects and very few data available for
training. This motivates us to consider employing more useful supervision
signal to train a discriminative model within limited training samples.
Specifically, the proposed MGA integrates a pre-trained semantic segmentation
model that produces auxiliary supervision signal, i.e., patchy attention mask,
enabling a discriminative representation learning. The patchy attention mask
drives the classifier to filter out the insignificant parts of images (e.g.,
common features between different categories), which enhances the robustness of
MGA for the fine-grained patchy image classification. We verify the
effectiveness of our method on three publicly available patchy image datasets.
Experimental results demonstrate that our MGA method achieves superior
performance on three datasets compared with the state-of-the-art methods. In
addition, our ablation study shows that MGA improves the accuracy by 2.25% and
2% on the SoyCultivarVein and BtfPIS datasets, indicating its practicality
towards solving the fine-grained patchy image classification.
</p>
"
