title,link,description
Adaptive Discretization for Adversarial Lipschitz Bandits. (arXiv:2006.12367v2 [cs.LG] UPDATED),http://arxiv.org/abs/2006.12367,"<p>Lipschitz bandits is a prominent version of multi-armed bandits that studies
large, structured action spaces such as the [0,1] interval, where similar
actions are guaranteed to have similar rewards. A central theme here is the
adaptive discretization of the action space, which gradually ""zooms in"" on the
more promising regions thereof. The goal is to take advantage of ""nicer""
problem instances, while retaining near-optimal worst-case performance. While
the stochastic version of the problem is well-understood, the general version
with adversarial rewards is not.
</p>
<p>We provide the first algorithm for adaptive discretization in the adversarial
version, and derive instance-dependent regret bounds. In particular, we recover
the worst-case optimal regret bound for the adversarial version, and the
instance-dependent regret bound for the stochastic version. Further, an
application of our algorithm to dynamic pricing (where a seller repeatedly
adjusts prices for a product) enjoys these regret bounds without any smoothness
assumptions.
</p>
"
Invertible Concept-based Explanations for CNN Models with Non-negative Concept Activation Vectors. (arXiv:2006.15417v3 [cs.CV] UPDATED),http://arxiv.org/abs/2006.15417,"<p>Convolutional neural network (CNN) models for computer vision are powerful
but lack explainability in their most basic form. This deficiency remains a key
challenge when applying CNNs in important domains. Recent work for explanations
through feature importance of approximate linear models has moved from
input-level features (pixels or segments) to features from mid-layer feature
maps in the form of concept activation vectors (CAVs). CAVs contain
concept-level information and could be learnt via clustering. In this work, we
rethink the ACE algorithm of Ghorbani et al., proposing an alternative
inevitable concept-based explanation (ICE) framework to overcome its
shortcomings. Based on the requirements of fidelity (approximate models to
target models) and interpretability (being meaningful to people), we design
measurements and evaluate a range of matrix factorization methods with our
framework. We find that \emph{non-negative concept activation vectors} (NCAVs)
from non-negative matrix factorization provide superior performance in
interpretability and fidelity based on computational and human subject
experiments. Our framework provides both local and global concept-level
explanations for pre-trained CNN models.
</p>
"
Multimodal Text Style Transfer for Outdoor Vision-and-Language Navigation. (arXiv:2007.00229v3 [cs.CL] UPDATED),http://arxiv.org/abs/2007.00229,"<p>One of the most challenging topics in Natural Language Processing (NLP) is
visually-grounded language understanding and reasoning. Outdoor
vision-and-language navigation (VLN) is such a task where an agent follows
natural language instructions and navigates a real-life urban environment. Due
to the lack of human-annotated instructions that illustrate intricate urban
scenes, outdoor VLN remains a challenging task to solve. This paper introduces
a Multimodal Text Style Transfer (MTST) learning approach and leverages
external multimodal resources to mitigate data scarcity in outdoor navigation
tasks. We first enrich the navigation data by transferring the style of the
instructions generated by Google Maps API, then pre-train the navigator with
the augmented external outdoor navigation dataset. Experimental results show
that our MTST learning approach is model-agnostic, and our MTST approach
significantly outperforms the baseline models on the outdoor VLN task,
improving task completion rate by 8.7% relatively on the test set.
</p>
"
Knowledge-Aware Language Model Pretraining. (arXiv:2007.00655v2 [cs.CL] UPDATED),http://arxiv.org/abs/2007.00655,"<p>How much knowledge do pretrained language models hold? Recent research
observed that pretrained transformers are adept at modeling semantics but it is
unclear to what degree they grasp human knowledge, or how to ensure they do so.
In this paper we incorporate knowledge-awareness in language model pretraining
without changing the transformer architecture, inserting explicit knowledge
layers, or adding external storage of semantic information. Rather, we simply
signal the existence of entities to the input of the transformer in
pretraining, with an entity-extended tokenizer; and at the output, with an
additional entity prediction task. Our experiments show that solely by adding
these entity signals in pretraining, significantly more knowledge is packed
into the transformer parameters: we observe improved language modeling
accuracy, factual correctness in LAMA knowledge probing tasks, and semantics in
the hidden representations through edge probing.We also show that our
knowledge-aware language model (KALM) can serve as a drop-in replacement for
GPT-2 models, significantly improving downstream tasks like zero-shot
question-answering with no task-related training.
</p>
"
MPC Protocol for G-module and its Application in Secure Compare and ReLU. (arXiv:2007.03975v3 [cs.CR] UPDATED),http://arxiv.org/abs/2007.03975,"<p>Secure comparison and secure selection are two fundamental MPC (secure
Multi-Party Computation) protocols. One important application of these
protocols is the secure ReLU and DReLU computation in privacy preserving deep
learning. In this paper, we introduce G-module, a mathematics tool, to
re-design such protocols. In mathematics, given a group G, a G-module is an
abelian group M on which G acts compatibly with the abelian group structure on
M.
</p>
<p>We design three secure protocols for three G-module operations. i.e.
""G-module action"", ""Cross G-module action"" and ""G-module recover"". As far as we
know, this is the first work on secure G-module operations. Based on them, we
design secure comparison, selection, ReLU and DReLU protocols, which improve
communication efficiency by 2X to 10X compared with state of arts. Our
protocols are very computation efficient too. They do not require public key
operations or any other expensive operations.
</p>
"
Algorithmic applications of the corestriction of central simple algebras. (arXiv:2007.06981v4 [math.NT] UPDATED),http://arxiv.org/abs/2007.06981,"<p>Let $L$ be a separable quadratic extension of either $\mathbb{Q}$ or
$\mathbb{F}_q(t)$. We propose efficient algorithms for finding isomorphisms
between quaternion algebras over $L$. Our techniques are based on computing
maximal one-sided ideals of the corestriction of a central simple $L$-algebra.
In order to obtain efficient algorithms in the characteristic 2 case, we
propose an algorithm for finding nontrivial zeros of a regular quadratic form
in four variables over $\mathbb{F}_{2^k}(t)$.
</p>
"
Relaxed-Responsibility Hierarchical Discrete VAEs. (arXiv:2007.07307v2 [stat.ML] UPDATED),http://arxiv.org/abs/2007.07307,"<p>Successfully training Variational Autoencoders (VAEs) with a hierarchy of
discrete latent variables remains an area of active research.
</p>
<p>Vector-Quantised VAEs are a powerful approach to discrete VAEs, but naive
hierarchical extensions can be unstable when training. Leveraging insights from
classical methods of inference we introduce \textit{Relaxed-Responsibility
Vector-Quantisation}, a novel way to parameterise discrete latent variables, a
refinement of relaxed Vector-Quantisation that gives better performance and
more stable training. This enables a novel approach to hierarchical discrete
variational autoencoders with numerous layers of latent variables (here up to
32) that we train end-to-end. Within hierarchical probabilistic deep generative
models with discrete latent variables trained end-to-end, we achieve
state-of-the-art bits-per-dim results for various standard datasets. % Unlike
discrete VAEs with a single layer of latent variables, we can produce samples
by ancestral sampling: it is not essential to train a second autoregressive
generative model over the learnt latent representations to then sample from and
then decode. % Moreover, that latter approach in these deep hierarchical models
would require thousands of forward passes to generate a single sample. Further,
we observe different layers of our model become associated with different
aspects of the data.
</p>
"
An empirical study of Linespots: A novel past-fault algorithm. (arXiv:2007.09394v2 [cs.SE] UPDATED),http://arxiv.org/abs/2007.09394,"<p>This paper proposes the novel past-faults fault prediction algorithm
Linespots, based on the Bugspots algorithm. We analyze the predictive
performance and runtime of Linespots compared to Bugspots with an empirical
study using the most significant self-built dataset as of now, including
high-quality samples for validation. As a novelty in fault prediction, we use
Bayesian data analysis and Directed Acyclic Graphs to model the effects. We
found consistent improvements in the predictive performance of Linespots over
Bugspots for all seven evaluation metrics. We conclude that Linespots should be
used over Bugspots in all cases where no real-time performance is necessary.
</p>
"
Calibration of Google Trends Time Series. (arXiv:2007.13861v5 [cs.SI] UPDATED),http://arxiv.org/abs/2007.13861,"<p>Google Trends is a tool that allows researchers to analyze the popularity of
Google search queries across time and space. In a single request, users can
obtain time series for up to 5 queries on a common scale, normalized to the
range from 0 to 100 and rounded to integer precision. Despite the overall value
of Google Trends, rounding causes major problems, to the extent that entirely
uninformative, all-zero time series may be returned for unpopular queries when
requested together with more popular queries. We address this issue by
proposing Google Trends Anchor Bank (G-TAB), an efficient solution for the
calibration of Google Trends data. Our method expresses the popularity of an
arbitrary number of queries on a common scale without being compromised by
rounding errors. The method proceeds in two phases. In the offline
preprocessing phase, an ""anchor bank"" is constructed, a set of queries spanning
the full spectrum of popularity, all calibrated against a common reference
query by carefully chaining together multiple Google Trends requests. In the
online deployment phase, any given search query is calibrated by performing an
efficient binary search in the anchor bank. Each search step requires one
Google Trends request, but few steps suffice, as we demonstrate in an empirical
evaluation. We make our code publicly available as an easy-to-use library at
https://github.com/epfl-dlab/GoogleTrendsAnchorBank.
</p>
"
A Process Mining Software Comparison. (arXiv:2007.14038v3 [cs.SE] UPDATED),http://arxiv.org/abs/2007.14038,"<p>www.processmining-software.com is a dedicated website for process mining
software comparison and was developed to give practitioners and researchers an
overview of commercial tools available on the market. Based on literature
review and experimental tool testing, a set of criteria was developed in order
to assess the tools' functional capabilities in an objective manner. With our
publicly accessible website, we intend to increase the transparency of tool
functionality. Being an academic endeavour, the non-commercial nature of the
study ensures a less biased assessment as compared with reports from analyst
firms.
</p>
"
An Empirical Survey of Data Augmentation for Time Series Classification with Neural Networks. (arXiv:2007.15951v2 [cs.LG] UPDATED),http://arxiv.org/abs/2007.15951,"<p>In recent times, deep artificial neural networks have achieved many successes
in pattern recognition. Part of this success can be attributed to the reliance
on big data to increase generalization. However, in the field of time series
recognition, many datasets are often very small. One method of addressing this
problem is through the use of data augmentation. In this paper, we survey data
augmentation techniques for time series and their application to time series
classification with neural networks. We outline four families of time series
data augmentation, including transformation-based methods, pattern mixing,
generative models, and decomposition methods, and detail their taxonomy.
Furthermore, we empirically evaluate 12 time series data augmentation methods
on 128 time series classification datasets with 6 different types of neural
networks. Through the results, we are able to analyze the characteristics,
advantages and disadvantages, and recommendations of each data augmentation
method. This survey aims to help in the selection of time series data
augmentation for neural network applications.
</p>
"
Noise-Response Analysis of Deep Neural Networks Quantifies Robustness and Fingerprints Structural Malware. (arXiv:2008.00123v2 [cs.LG] UPDATED),http://arxiv.org/abs/2008.00123,"<p>The ubiquity of deep neural networks (DNNs), cloud-based training, and
transfer learning is giving rise to a new cybersecurity frontier in which
unsecure DNNs have `structural malware' (i.e., compromised weights and
activation pathways). In particular, DNNs can be designed to have backdoors
that allow an adversary to easily and reliably fool an image classifier by
adding a pattern of pixels called a trigger. It is generally difficult to
detect backdoors, and existing detection methods are computationally expensive
and require extensive resources (e.g., access to the training data). Here, we
propose a rapid feature-generation technique that quantifies the robustness of
a DNN, `fingerprints' its nonlinearity, and allows us to detect backdoors (if
present). Our approach involves studying how a DNN responds to noise-infused
images with varying noise intensity, which we summarize with titration curves.
We find that DNNs with backdoors are more sensitive to input noise and respond
in a characteristic way that reveals the backdoor and where it leads (its
`target'). Our empirical results demonstrate that we can accurately detect
backdoors with high confidence orders-of-magnitude faster than existing
approaches (seconds versus hours).
</p>
"
Accuracy and Fairness Trade-offs in Machine Learning: A Stochastic Multi-Objective Approach. (arXiv:2008.01132v2 [cs.LG] UPDATED),http://arxiv.org/abs/2008.01132,"<p>In the application of machine learning to real-life decision-making systems,
e.g., credit scoring and criminal justice, the prediction outcomes might
discriminate against people with sensitive attributes, leading to unfairness.
The commonly used strategy in fair machine learning is to include fairness as a
constraint or a penalization term in the minimization of the prediction loss,
which ultimately limits the information given to decision-makers. In this
paper, we introduce a new approach to handle fairness by formulating a
stochastic multi-objective optimization problem for which the corresponding
Pareto fronts uniquely and comprehensively define the accuracy-fairness
trade-offs. We have then applied a stochastic approximation-type method to
efficiently obtain well-spread and accurate Pareto fronts, and by doing so we
can handle training data arriving in a streaming way.
</p>
"
Point Proposal Network: Accelerating Point Source Detection Through Deep Learning. (arXiv:2008.02093v2 [cs.CV] UPDATED),http://arxiv.org/abs/2008.02093,"<p>Point source detection techniques are used to identify and localise point
sources in radio astronomical surveys. With the development of the Square
Kilometre Array (SKA) telescope, survey images will see a massive increase in
size from Gigapixels to Terapixels. Point source detection has already proven
to be a challenge in recent surveys performed by SKA pathfinder telescopes.
This paper proposes the Point Proposal Network (PPN): a point source detector
that utilises deep convolutional neural networks for fast source detection.
Results measured on simulated MeerKAT images show that, although less precise
when compared to leading alternative approaches, PPN performs source detection
faster and is able to scale to large images, unlike the alternative approaches.
</p>
"
Data-driven reduced-order models via regularized operator inference for a single-injector combustion process. (arXiv:2008.02862v2 [cs.CE] UPDATED),http://arxiv.org/abs/2008.02862,"<p>This paper derives predictive reduced-order models for rocket engine
combustion dynamics via Operator Inference, a scientific machine learning
approach that blends data-driven learning with physics-based modeling. The
non-intrusive nature of the approach enables variable transformations that
expose system structure. The specific contribution of this paper is to advance
the formulation robustness and algorithmic scalability of the Operator
Inference approach. Regularization is introduced to the formulation to avoid
over-fitting. The task of determining an optimal regularization is posed as an
optimization problem that balances training error and stability of long-time
integration dynamics. A scalable algorithm and open-source implementation are
presented, then demonstrated for a single-injector rocket combustion example.
This example exhibits rich dynamics that are difficult to capture with
state-of-the-art reduced models. With appropriate regularization and an
informed selection of learning variables, the reduced-order models exhibit high
accuracy in re-predicting the training regime and acceptable accuracy in
predicting future dynamics, while achieving close to a million times speedup in
computational cost. When compared to a state-of-the-art model reduction method,
the Operator Inference models provide the same or better accuracy at
approximately one thousandth of the computational cost.
</p>
"
On construction and (non)existence of $c$-(almost) perfect nonlinear functions. (arXiv:2008.03953v3 [math.CO] UPDATED),http://arxiv.org/abs/2008.03953,"<p>Functions with low differential uniformity have relevant applications in
cryptography. Recently, functions with low $c$-differential uniformity
attracted lots of attention. In particular, so-called APcN and PcN functions
(generalization of APN and PN functions) have been investigated. Here, we
provide a characterization of such functions via quadratic polynomials as well
as non-existence results.
</p>
"
Distributed Stochastic Subgradient Optimization Algorithms Over Random and Noisy Networks. (arXiv:2008.08796v4 [eess.SY] UPDATED),http://arxiv.org/abs/2008.08796,"<p>We study distributed stochastic optimization by networked nodes to
cooperatively minimize a sum of convex cost functions. The network is modeled
by a sequence of time-varying random digraphs with each node representing a
local optimizer and each edge representing a communication link. We consider
the distributed subgradient optimization algorithm with noisy measurements of
local cost functions' subgradients, additive and multiplicative noises among
information exchanging between each pair of nodes. By stochastic Lyapunov
method, convex analysis, algebraic graph theory and martingale convergence
theory, it is proved that if the local subgradient functions grow linearly and
the sequence of digraphs is conditionally balanced and uniformly conditionally
jointly connected, then proper algorithm step sizes can be designed so that all
nodes' states converge to the global optimal solution almost surely.
</p>
"
Active Disturbance Rejection Control Design with Suppression of Sensor Noise Effects in Application to DC-DC Buck Power Converter. (arXiv:2009.02948v2 [eess.SY] UPDATED),http://arxiv.org/abs/2009.02948,"<p>The performance of active disturbance rejection control (ADRC) algorithms can
be limited in practice by high-frequency measurement noise. In this work, this
problem is addressed by transforming the high-gain extended state observer
(ESO), which is the inherent element of ADRC, into a new cascade observer
structure. Set of experiments, performed on a DC-DC buck power converter
system, show that the new cascade ESO design, compared to the conventional
approach, effectively suppresses the detrimental effect of sensor noise
over-amplification while increasing the estimation/control performance. The
proposed design is also analyzed with a low-pass filter at the converter
output, which is a common technique for reducing measurement noise in
industrial applications.
</p>
"
Ebb-and-Flow Protocols: A Resolution of the Availability-Finality Dilemma. (arXiv:2009.04987v3 [cs.CR] UPDATED),http://arxiv.org/abs/2009.04987,"<p>The CAP theorem says that no blockchain can be live under dynamic
participation and safe under temporary network partitions. To resolve this
availability-finality dilemma, we formulate a new class of flexible consensus
protocols, ebb-and-flow protocols, which support a full dynamically available
ledger in conjunction with a finalized prefix ledger. The finalized ledger
falls behind the full ledger when the network partitions but catches up when
the network heals. Gasper, the current candidate protocol for Ethereum 2.0's
beacon chain, combines the finality gadget Casper FFG with the LMD GHOST fork
choice rule and aims to achieve this property. However, we discovered an attack
in the standard synchronous network model, highlighting a general difficulty
with existing finality-gadget-based designs. We present a construction of
provably secure ebb-and-flow protocols with optimal resilience. Nodes run an
off-the-shelf dynamically available protocol, take snapshots of the growing
available ledger, and input them into a separate off-the-shelf BFT protocol to
finalize a prefix. We explore connections with flexible BFT and improve upon
the state-of-the-art for that problem.
</p>
"
Contrastive Triple Extraction with Generative Transformer. (arXiv:2009.06207v4 [cs.CL] UPDATED),http://arxiv.org/abs/2009.06207,"<p>Triple extraction is an essential task in information extraction for natural
language processing and knowledge graph construction. In this paper, we revisit
the end-to-end triple extraction task for sequence generation. Since generative
triple extraction may struggle to capture long-term dependencies and generate
unfaithful triples, we introduce a novel model, contrastive triple extraction
with a generative transformer. Specifically, we introduce a single shared
transformer module for encoder-decoder-based generation. To generate faithful
results, we propose a novel triplet contrastive training object. Moreover, we
introduce two mechanisms to further improve model performance (i.e., batch-wise
dynamic attention-masking and triple-wise calibration). Experimental results on
three datasets (i.e., NYT, WebNLG, and MIE) show that our approach achieves
better performance than that of baselines.
</p>
"
A categorical duality for algebras of partial functions. (arXiv:2009.07895v2 [math.RA] UPDATED),http://arxiv.org/abs/2009.07895,"<p>We prove a categorical duality between a class of abstract algebras of
partial functions and a class of (small) topological categories. The algebras
are the isomorphs of collections of partial functions closed under the
operations of composition, antidomain, range, and preferential union (or
'override'). The topological categories are those whose space of objects is a
Stone space, source map is a local homeomorphism, target map is open, and all
of whose arrows are epimorphisms.
</p>
"
A General Framework for the Security Analysis of Blockchain Protocols. (arXiv:2009.09480v3 [cs.DC] UPDATED),http://arxiv.org/abs/2009.09480,"<p>Blockchain protocols differ in fundamental ways, including the mechanics of
selecting users to produce blocks (e.g., proof-of-work vs. proof-of-stake) and
the method to establish consensus (e.g., longest chain rules vs. Byzantine
fault-tolerant (BFT) inspired protocols). These fundamental differences have
hindered ""apples-to-apples"" comparisons between different categories of
blockchain protocols and, in turn, the development of theory to formally
discuss their relative merits.
</p>
<p>This paper presents a parsimonious abstraction sufficient for capturing and
comparing properties of many well-known permissionless blockchain protocols,
simultaneously capturing essential properties of both proof-of-work (PoW) and
proof-of-stake (PoS) protocols, and of both longest-chain-type and BFT-type
protocols. Our framework blackboxes the precise mechanics of the user selection
process, allowing us to isolate the properties of the selection process that
are significant for protocol design.
</p>
<p>We demonstrate the utility of our general framework with several concrete
results:
</p>
<p>1. We prove a CAP-type impossibility theorem asserting that liveness with an
unknown level of participation rules out security in a partially synchronous
setting.
</p>
<p>2. Delving deeper into the partially synchronous setting, we prove that a
necessary and sufficient condition for security is the production of
""certificates,"" meaning stand-alone proofs of block confirmation.
</p>
<p>3. Restricting to synchronous settings, we prove that typical protocols with
a known level of participation (including longest chain-type PoS protocols) can
be adapted to provide certificates, but those with an unknown level of
participation cannot.
</p>
<p>4. Finally, we use our framework to articulate a modular two-step approach to
blockchain security analysis that effectively reduces the permissionless case
to the permissioned case.
</p>
"
