title,link,description
Parametrized Quantum Circuits of Synonymous Sentences in Quantum Natural Language Processing. (arXiv:2102.02204v1 [quant-ph]),http://arxiv.org/abs/2102.02204,"<p>In this paper, we develop a compositional vector-based semantics of positive
transitive sentences in quantum natural language processing for a non-English
language, i.e. Persian, to compare the parametrized quantum circuits of two
synonymous sentences in two languages, English and Persian. By considering
grammar+meaning of a transitive sentence, we translate DisCoCat diagram via
ZX-calculus into quantum circuit form. Also, we use a bigraph method to rewrite
DisCoCat diagram and turn into quantum circuit in the semantic side.
</p>
"
Harvest -- An Open Source Toolkit for Extracting Posts and Post Metadata from Web Forums. (arXiv:2102.02240v1 [cs.IR]),http://arxiv.org/abs/2102.02240,"<p>Automatic extraction of forum posts and metadata is a crucial but challenging
task since forums do not expose their content in a standardized structure.
Content extraction methods, therefore, often need customizations such as
adaptations to page templates and improvements of their extraction code before
they can be deployed to new forums. Most of the current solutions are also
built for the more general case of content extraction from web pages and lack
key features important for understanding forum content such as the
identification of author metadata and information on the thread structure.
</p>
<p>This paper, therefore, presents a method that determines the XPath of forum
posts, eliminating incorrect mergers and splits of the extracted posts that
were common in systems from the previous generation. Based on the individual
posts further metadata such as authors, forum URL and structure are extracted.
We also introduce Harvest, a new open source toolkit that implements the
presented methods and create a gold standard extracted from 52 different Web
forums for evaluating our approach. A comprehensive evaluation reveals that
Harvest clearly outperforms competing systems.
</p>
"
Information-theoretic Key Encapsulation and its Application to Secure Communication. (arXiv:2102.02243v1 [cs.CR]),http://arxiv.org/abs/2102.02243,"<p>A hybrid encryption scheme is a public key encryption system that consists of
a public-key part called the key encapsulation mechanism (KEM), and a
(symmetric) secret-key part called data encapsulation mechanism (DEM): the
public-key part is used to generate a shared secret key between the two
parties, and the symmetric key part is used to encrypt the message. Hybrid
encryption schemes are widely used for secure communication over the Internet.
In this paper, we initiate the study of hybrid encryption in preprocessing
model which assumes access to initial correlated variables by all the parties
(including the eavesdropper). We define information theoretic KEM (iKEM) that
together with a (computationally) secure DEM results in a hybrid encryption
scheme in preprocessing model. We define security of each building block and
prove a composition theorem that guarantees security of the final encryption
system. We showthat iKEM can be realized by a one-message SKA (OW-SKA)protocol
with an extended security definition. Using a OW-SKA that satisfies this
extended definition of security effectively allows the secret key that is
generated by the OW-SKA to be used with symmetric key encryption system such as
AES in counter mode. We discuss our results and future work including providing
stronger security for the final encryption, and using information theoretic DEM
to construct information theoretic encryption systems.
</p>
"
Bounds and Genericity of Sum-Rank-Metric Codes. (arXiv:2102.02244v1 [cs.IT]),http://arxiv.org/abs/2102.02244,"<p>We derive simplified sphere-packing and Gilbert-Varshamov bounds for codes in
the sum-rank metric, which can be computed more efficently than previous
ones.They give rise to asymptotic bounds that cover the asymptotic setting that
has not yet been considered in the literature: families of sum-rank-metric
codes whose block size grows in the code length. We also provide two genericity
results: we show that random linear codes achieve almost the sum-rank-metric
Gilbert-Varshamov bound with high probability. Furthermore, we derive bounds on
the probability that a random linear code attains the sum-rank-metric Singleton
bound, showing that for large enough extension field, almost all linear codes
achieve it.
</p>
"
The Forgotten Document-Oriented Database Management Systems: An Overview and Benchmark of Native XML DODBMSes in Comparison with JSON DODBMSes. (arXiv:2102.02246v1 [cs.DB]),http://arxiv.org/abs/2102.02246,"<p>In the current context of Big Data, a multitude of new NoSQL solutions for
storing, managing, and extracting information and patterns from semi-structured
data have been proposed and implemented. These solutions were developed to
relieve the issue of rigid data structures present in relational databases, by
introducing semi-structured and flexible schema design. As current data
generated by different sources and devices, especially from IoT sensors and
actuators, use either XML or JSON format, depending on the application,
database technologies that store and query semi-structured data in XML format
are needed. Thus, Native XML Databases, which were initially designed to
manipulate XML data using standardized querying languages, i.e., XQuery and
XPath, were rebranded as NoSQL Document-Oriented Databases Systems. Currently,
the majority of these solutions have been replaced with the more modern JSON
based Database Management Systems. However, we believe that XML-based solutions
can still deliver performance in executing complex queries on heterogeneous
collections. Unfortunately nowadays, research lacks a clear comparison of the
scalability and performance for database technologies that store and query
documents in XML versus the more modern JSON format. Moreover, to the best of
our knowledge, there are no Big Data-compliant benchmarks for such database
technologies. In this paper, we present a comparison for selected
Document-Oriented Database Systems that either use the XML format to encode
documents, i.e., BaseX, eXist-db, and Sedna, or the JSON format, i.e., MongoDB,
CouchDB, and Couchbase. To underline the performance differences we also
propose a benchmark that uses a heterogeneous complex schema on a large DBLP
corpus.
</p>
"
Low-cost attacks on Ethereum 2.0 by sub-1/3 stakeholders. (arXiv:2102.02247v1 [cs.CR]),http://arxiv.org/abs/2102.02247,"<p>We outline two dishonest strategies that can be cheaply executed on the
Ethereum 2.0 beacon chain, even by validators holding less than one-third of
the total stake: malicious chain reorganizations (""reorgs"") and finality
delays. In a malicious reorg, an attacker withholds their blocks and
attestations before releasing them at an opportune time in order to force a
chain reorganization, which they can take advantage of by double-spending or
front-running transactions. To execute a finality delay an attacker uses
delayed block releases and withholding of attestations to increase the mean and
variance of the time it takes blocks to become finalized. This impacts the
efficiency and predictability of the system. We provide a probabilistic and
cost analysis for each of these attacks, considering a validator with 30% of
the total stake.
</p>
"
Optimal Excitation Matching Strategy for Sub-Arrayed Phased Linear Arrays Generating Arbitrary-Shaped Beams. (arXiv:2102.02258v1 [eess.SY]),http://arxiv.org/abs/2102.02258,"<p>The design of phased arrays able to generate arbitrary-shaped beams through a
sub-arrayed architecture is addressed here. The synthesis problem is cast in
the excitation matching framework, so as to yield clustered phased arrays
providing optimal trade-offs between the complexity of the array architecture
(i.e., the minimum number of control points at the sub-array level) and the
matching of a reference pattern. A synthesis tool based on the k-means
algorithm is proposed for jointly optimizing the sub-array configuration and
the complex sub-array coefficients. Selected numerical results, including
pencil beams with sidelobe notches and asymmetric lobes as well as shaped main
lobes, are reported and discussed to highlight the peculiarities of the
proposed approach also in comparison with some extensions to complex
excitations of state-of-the-art sub-array design methods.
</p>
"
Modular Design of Hexagonal Phased Arrays Through Diamond Tiles. (arXiv:2102.02262v1 [eess.SY]),http://arxiv.org/abs/2102.02262,"<p>The modular design of planar phased array antennas with hexagonal apertures
is addressed by means of innovative diamond-shaped tiling techniques. Both
tiling configuration and subarray coefficients are optimized to fit
user-defined power-mask constraints on the radiation pattern. Toward this end,
suitable surface-tiling mathematical theorems are customized to the problem at
hand to guarantee optimal performance in case of low/medium-size arrays, while
the computationally hard tiling of large arrays is yielded thanks to an
effective integer-coded GA-based exploration of the arising high-cardinality
solution spaces. By considering ideal as well as real array models, a set of
representative benchmark problems is dealt with to assess the effectiveness of
the proposed architectures and tiling strategies. Moreover, comparisons with
alternative tiling architectures are also performed to show to the interested
readers the advantages and the potentialities of the diamond subarraying of
hexagonal apertures.
</p>
"
DEFT: Detection Embeddings for Tracking. (arXiv:2102.02267v1 [cs.CV]),http://arxiv.org/abs/2102.02267,"<p>Most modern multiple object tracking (MOT) systems follow the
tracking-by-detection paradigm, consisting of a detector followed by a method
for associating detections into tracks. There is a long history in tracking of
combining motion and appearance features to provide robustness to occlusions
and other challenges, but typically this comes with the trade-off of a more
complex and slower implementation. Recent successes on popular 2D tracking
benchmarks indicate that top-scores can be achieved using a state-of-the-art
detector and relatively simple associations relying on single-frame spatial
offsets -- notably outperforming contemporary methods that leverage learned
appearance features to help re-identify lost tracks. In this paper, we propose
an efficient joint detection and tracking model named DEFT, or ""Detection
Embeddings for Tracking."" Our approach relies on an appearance-based object
matching network jointly-learned with an underlying object detection network.
An LSTM is also added to capture motion constraints. DEFT has comparable
accuracy and speed to the top methods on 2D online tracking leaderboards while
having significant advantages in robustness when applied to more challenging
tracking data. DEFT raises the bar on the nuScenes monocular 3D tracking
challenge, more than doubling the performance of the previous top method. Code
is publicly available.
</p>
"
A Heuristic for Dynamic Output Predictive Control Design for Uncertain Nonlinear Systems. (arXiv:2102.02268v1 [eess.SY]),http://arxiv.org/abs/2102.02268,"<p>In this paper, a simple heuristic is proposed for the design of uncertainty
aware predictive controllers for nonlinear models involving uncertain
parameters. The method relies on Machine Learning-based approximation of ideal
deterministic MPC solutions with perfectly known parameters. An efficient
construction of the learning data set from these off-line solutions is proposed
in which each solution provides many samples in the learning data. This enables
a drastic reduction of the required number of Non Linear Programming problems
to be solved off-line while explicitly exploiting the statistics of the
parameters dispersion. The learning data is then used to design a fast on-line
output dynamic feedback that explicitly incorporate information of the
statistics of the parameters dispersion. An example is provided to illustrate
the efficiency and the relevance of the proposed framework. It is in particular
shown that the proposed solution recovers up to 78\% of the expected advantage
of having a perfect knowledge of the parameters compared to nominal design.
</p>
"
Numerical Differentiation using local Chebyshev-Approximation. (arXiv:2102.02269v1 [math.NA]),http://arxiv.org/abs/2102.02269,"<p>In applied mathematics, especially in optimization, functions are often only
provided as so called ""Black-Boxes"" provided by software packages, or very
complex algorithms, which make automatic differentation very complicated or
even impossible. Hence one seeks the numerical approximation of the derivative.
</p>
<p>Unfortunately numerical differentation is a difficult task in itself, and it
is well known that it is numerical instable. There are many works on this
topic, including the usage of (global) Chebyshev approximations. Chebyshev
approximations have the great property that they converge very fast, if the
function is smooth. Nevertheless those approches have several drawbacks, since
in practice functions are not smooth, and a global approximation needs many
function evalutions.
</p>
<p>Nevertheless there is hope. Since functions in real world applications are
most times smooth except for finite points, corners or edges. This motivates to
use a local Chebyshev approach, where the function is only approximated
locally, and hence the Chebyshev approximations still yields a fast
approximation of the desired function. We will study such an approch in this
work, and will provide a numerical example
</p>
"
Confusion2vec 2.0: Enriching Ambiguous Spoken Language Representations with Subwords. (arXiv:2102.02270v1 [cs.CL]),http://arxiv.org/abs/2102.02270,"<p>Word vector representations enable machines to encode human language for
spoken language understanding and processing. Confusion2vec, motivated from
human speech production and perception, is a word vector representation which
encodes ambiguities present in human spoken language in addition to semantics
and syntactic information. Confusion2vec provides a robust spoken language
representation by considering inherent human language ambiguities. In this
paper, we propose a novel word vector space estimation by unsupervised learning
on lattices output by an automatic speech recognition (ASR) system. We encode
each word in confusion2vec vector space by its constituent subword character
n-grams. We show the subword encoding helps better represent the acoustic
perceptual ambiguities in human spoken language via information modeled on
lattice structured ASR output. The usefulness of the proposed Confusion2vec
representation is evaluated using semantic, syntactic and acoustic analogy and
word similarity tasks. We also show the benefits of subword modeling for
acoustic ambiguity representation on the task of spoken language intent
detection. The results significantly outperform existing word vector
representations when evaluated on erroneous ASR outputs. We demonstrate that
Confusion2vec subword modeling eliminates the need for retraining/adapting the
natural language understanding models on ASR transcripts.
</p>
"
Neural Recursive Belief States in Multi-Agent Reinforcement Learning. (arXiv:2102.02274v1 [cs.LG]),http://arxiv.org/abs/2102.02274,"<p>In multi-agent reinforcement learning, the problem of learning to act is
particularly difficult because the policies of co-players may be heavily
conditioned on information only observed by them. On the other hand, humans
readily form beliefs about the knowledge possessed by their peers and leverage
beliefs to inform decision-making. Such abilities underlie individual success
in a wide range of Markov games, from bluffing in Poker to conditional
cooperation in the Prisoner's Dilemma, to convention-building in Bridge.
Classical methods are usually not applicable to complex domains due to the
intractable nature of hierarchical beliefs (i.e. beliefs of other agents'
beliefs). We propose a scalable method to approximate these belief structures
using recursive deep generative models, and to use the belief models to obtain
representations useful to acting in complex tasks. Our agents trained with
belief models outperform model-free baselines with equivalent representational
capacity using common training paradigms. We also show that higher-order belief
models outperform agents with lower-order models.
</p>
"
Modelling and simulation of a wave energy converter. (arXiv:2102.02275v1 [math.AP]),http://arxiv.org/abs/2102.02275,"<p>In this work we present the mathematical model and simulations of a
particular wave energy converter, the so-called oscillating water column. In
this device, waves governed by the one-dimensional nonlinear shallow water
equations arrive from offshore, encounter a step in the bottom and then arrive
into a chamber to change the volume of the air to activate the turbine. The
system is reformulated as two transmission problems: one is related to the wave
motion over the stepped topography and the other one is related to the
wave-structure interaction at the entrance of the chamber. We finally use the
characteristic equations of Riemann invariants to obtain the discretized
transmission conditions and we implement the Lax-Friedrichs scheme to get
numerical solutions.
</p>
"
Insiders and Outsiders in Research on Machine Learning and Society. (arXiv:2102.02279v1 [cs.CY]),http://arxiv.org/abs/2102.02279,"<p>A subset of machine learning research intersects with societal issues,
including fairness, accountability and transparency, as well as the use of
machine learning for social good. In this work, we analyze the scholars
contributing to this research at the intersection of machine learning and
society through the lens of the sociology of science. By analyzing the
authorship of all machine learning papers posted to arXiv, we show that
compared to researchers from overrepresented backgrounds (defined by gender and
race/ethnicity), researchers from underrepresented backgrounds are more likely
to conduct research at this intersection than other kinds of machine learning
research. This state of affairs leads to contention between two perspectives on
insiders and outsiders in the scientific enterprise: outsiders being those
outside the group being studied, and outsiders being those who have not
participated as researchers in an area historically. This contention manifests
as an epistemic question on the validity of knowledge derived from lived
experience in machine learning research, and predicts boundary work that we see
in a real-world example.
</p>
"
Downbeat Tracking with Tempo-Invariant Convolutional Neural Networks. (arXiv:2102.02282v1 [cs.SD]),http://arxiv.org/abs/2102.02282,"<p>The human ability to track musical downbeats is robust to changes in tempo,
and it extends to tempi never previously encountered. We propose a
deterministic time-warping operation that enables this skill in a convolutional
neural network (CNN) by allowing the network to learn rhythmic patterns
independently of tempo. Unlike conventional deep learning approaches, which
learn rhythmic patterns at the tempi present in the training dataset, the
patterns learned in our model are tempo-invariant, leading to better tempo
generalisation and more efficient usage of the network capacity. We test the
generalisation property on a synthetic dataset created by rendering the Groove
MIDI Dataset using FluidSynth, split into a training set containing the
original performances and a test set containing tempo-scaled versions rendered
with different SoundFonts (test-time augmentation). The proposed model
generalises nearly perfectly to unseen tempi (F-measure of 0.89 on both
training and test sets), whereas a comparable conventional CNN achieves similar
accuracy only for the training set (0.89) and drops to 0.54 on the test set.
The generalisation advantage of the proposed model extends to real music, as
shown by results on the GTZAN and Ballroom datasets.
</p>
"
HiCOPS: High Performance Computing Framework for Tera-Scale Database Search of Mass Spectrometry based Omics Data. (arXiv:2102.02286v1 [cs.DC]),http://arxiv.org/abs/2102.02286,"<p>Database-search algorithms, that deduce peptides from Mass Spectrometry (MS)
data, have tried to improve the computational efficiency to accomplish larger,
and more complex systems biology studies. Existing serial, and high-performance
computing (HPC) search engines, otherwise highly successful, are known to
exhibit poor-scalability with increasing size of theoretical search-space
needed for increased complexity of modern non-model, multi-species MS-based
omics analysis. Consequently, the bottleneck for computational techniques is
the communication costs of moving the data between hierarchy of memory, or
processing units, and not the arithmetic operations. This post-Moore change in
architecture, and demands of modern systems biology experiments have dampened
the overall effectiveness of the existing HPC workflows. We present a novel
efficient parallel computational method, and its implementation on
memory-distributed architectures for peptide identification tool called HiCOPS,
that enables more than 100-fold improvement in speed over most existing HPC
proteome database search tools. HiCOPS empowers the supercomputing database
search concept for comprehensive identification of peptides, and all their
modified forms within a reasonable time-frame. We demonstrate this by searching
Gigabytes of experimental MS data against Terabytes of databases where HiCOPS
completes peptide identification in few minutes using 72 parallel nodes (1728
cores) compared to several weeks required by existing state-of-the-art tools
using 1 node (24 cores); 100 minutes vs 5 weeks; 500x speedup. Finally, we
formulate a theoretical framework for our overhead-avoiding strategy, and
report superior performance evaluation results for key metrics including
execution time, CPU utilization, speedups, and I/O efficiency. We also
demonstrate superior performance as compared to all existing HPC strategies.
</p>
"
Echo-SyncNet: Self-supervised Cardiac View Synchronization in Echocardiography. (arXiv:2102.02287v1 [cs.CV]),http://arxiv.org/abs/2102.02287,"<p>In echocardiography (echo), an electrocardiogram (ECG) is conventionally used
to temporally align different cardiac views for assessing critical
measurements. However, in emergencies or point-of-care situations, acquiring an
ECG is often not an option, hence motivating the need for alternative temporal
synchronization methods. Here, we propose Echo-SyncNet, a self-supervised
learning framework to synchronize various cross-sectional 2D echo series
without any external input. The proposed framework takes advantage of both
intra-view and inter-view self supervisions. The former relies on
spatiotemporal patterns found between the frames of a single echo cine and the
latter on the interdependencies between multiple cines. The combined
supervisions are used to learn a feature-rich embedding space where multiple
echo cines can be temporally synchronized. We evaluate the framework with
multiple experiments: 1) Using data from 998 patients, Echo-SyncNet shows
promising results for synchronizing Apical 2 chamber and Apical 4 chamber
cardiac views; 2) Using data from 3070 patients, our experiments reveal that
the learned representations of Echo-SyncNet outperform a supervised deep
learning method that is optimized for automatic detection of fine-grained
cardiac phase; 3) We show the usefulness of the learned representations in a
one-shot learning scenario of cardiac keyframe detection. Without any
fine-tuning, keyframes in 1188 validation patient studies are identified by
synchronizing them with only one labeled reference study. We do not make any
prior assumption about what specific cardiac views are used for training and
show that Echo-SyncNet can accurately generalize to views not present in its
training set. Project repository: github.com/fatemehtd/Echo-SyncNet.
</p>
"
Nearest Neighbor-based Importance Weighting. (arXiv:2102.02291v1 [cs.LG]),http://arxiv.org/abs/2102.02291,"<p>Importance weighting is widely applicable in machine learning in general and
in techniques dealing with data covariate shift problems in particular. A
novel, direct approach to determine such importance weighting is presented. It
relies on a nearest neighbor classification scheme and is relatively
straightforward to implement. Comparative experiments on various classification
tasks demonstrate the effectiveness of our so-called nearest neighbor weighting
(NNeW) scheme. Considering its performance, our procedure can act as a simple
and effective baseline method for importance weighting.
</p>
"
