title,link,description
Boundary Stabilization and Observation of an Unstable Heat Equation in a General Multi-dimensional Domain. (arXiv:2102.02492v1 [eess.SY]),http://arxiv.org/abs/2102.02492,"<p>In this paper, we consider the exponential stabilization and observation of
an unstable heat equation in a general multi-dimensional domain by combining
the finite-dimensional spectral truncation technique and the recently developed
dynamics compensation approach. In contrast to the unstable one-dimensional
partial differential equation (PDE), such as the transport equation, wave
equation and the heat equation, that can be treated by the well-known PDE
backstepping method, stabilization of unstable PDE in a general
multi-dimensional domain is still a challenging problem. We treat the
stabilization and observation problems separately. A dynamical state feedback
law is proposed firstly to stabilize the unstable heat equation exponentially
and then a state observer is designed via a boundary measurement. Both the
stability of the closed-loop system and the well-posedness of the observer are
proved. Some of the theoretical results are validated by the numerical
simulations.
</p>
"
Keep it Simple: Data-efficient Learning for Controlling Complex Systems with Simple Models. (arXiv:2102.02493v1 [cs.RO]),http://arxiv.org/abs/2102.02493,"<p>When manipulating a novel object with complex dynamics, a state
representation is not always available, for example for deformable objects.
Learning both a representation and dynamics from observations requires large
amounts of data. We propose Learned Visual Similarity Predictive Control
(LVSPC), a novel method for data-efficient learning to control systems with
complex dynamics and high-dimensional state spaces from images. LVSPC leverages
a given simple model approximation from which image observations can be
generated. We use these images to train a perception model that estimates the
simple model state from observations of the complex system online. We then use
data from the complex system to fit the parameters of the simple model and
learn where this model is inaccurate, also online. Finally, we use Model
Predictive Control and bias the controller away from regions where the simple
model is inaccurate and thus where the controller is less reliable. We evaluate
LVSPC on two tasks; manipulating a tethered mass and a rope. We find that our
method performs comparably to state-of-the-art reinforcement learning methods
with an order of magnitude less data. LVSPC also completes the rope
manipulation task on a real robot with 80% success rate after only 10 trials,
despite using a perception system trained only on images from simulation.
</p>
"
Permutation-invariant quantum coding for quantum deletion channels. (arXiv:2102.02494v1 [quant-ph]),http://arxiv.org/abs/2102.02494,"<p>Quantum deletions, which are harder to correct than erasure errors, occur in
many realistic settings. It is therefore pertinent to develop quantum coding
schemes for quantum deletion channels. To date, not much is known about which
explicit quantum error correction codes can combat quantum deletions. We note
that {\em any} permutation-invariant quantum code that has a distance of $t+1$
can correct $t$ quantum deletions for any positive integer $t$ in both the
qubit and the qudit setting. Leveraging on coding properties of
permutation-invariant quantum codes under erasure errors, we derive
corresponding coding bounds for permutation-invariant quantum codes under
quantum deletions. We focus our attention on a specific family of $N$-qubit
permutation-invariant quantum codes, which we call shifted gnu codes, and show
that their encoding and decoding algorithms can be performed in $O(N)$ and
$O(N^2)$.
</p>
"
3D Surface Reconstruction From Multi-Date Satellite Images. (arXiv:2102.02502v1 [cs.CV]),http://arxiv.org/abs/2102.02502,"<p>The reconstruction of accurate three-dimensional environment models is one of
the most fundamental goals in the field of photogrammetry. Since satellite
images provide suitable properties for obtaining large-scale environment
reconstructions, there exist a variety of Stereo Matching based methods to
reconstruct point clouds for satellite image pairs. Recently, the first
Structure from Motion (SfM) based approach has been proposed, which allows to
reconstruct point clouds from multiple satellite images. In this work, we
propose an extension of this SfM based pipeline that allows us to reconstruct
not only point clouds but watertight meshes including texture information. We
provide a detailed description of several steps that are mandatory to exploit
state-of-the-art mesh reconstruction algorithms in the context of satellite
imagery. This includes a decomposition of finite projective camera calibration
matrices, a skew correction of corresponding depth maps and input images as
well as the recovery of real-world depth maps from reparameterized depth
values. The paper presents an extensive quantitative evaluation on multi-date
satellite images demonstrating that the proposed pipeline combined with current
meshing algorithms outperforms state-of-the-art point cloud reconstruction
algorithms in terms of completeness and median error. We make the source code
of our pipeline publicly available.
</p>
"
"Understanding the Capabilities, Limitations, and Societal Impact of Large Language Models. (arXiv:2102.02503v1 [cs.CL])",http://arxiv.org/abs/2102.02503,"<p>On October 14th, 2020, researchers from OpenAI, the Stanford Institute for
Human-Centered Artificial Intelligence, and other universities convened to
discuss open research questions surrounding GPT-3, the largest
publicly-disclosed dense language model at the time. The meeting took place
under Chatham House Rules. Discussants came from a variety of research
backgrounds including computer science, linguistics, philosophy, political
science, communications, cyber policy, and more. Broadly, the discussion
centered around two main questions: 1) What are the technical capabilities and
limitations of large language models? 2) What are the societal effects of
widespread use of large language models? Here, we provide a detailed summary of
the discussion organized by the two themes above.
</p>
"
Meta-strategy for Learning Tuning Parameters with Guarantees. (arXiv:2102.02504v1 [stat.ML]),http://arxiv.org/abs/2102.02504,"<p>Online gradient methods, like the online gradient algorithm (OGA), often
depend on tuning parameters that are difficult to set in practice. We consider
an online meta-learning scenario, and we propose a meta-strategy to learn these
parameters from past tasks. Our strategy is based on the minimization of a
regret bound. It allows to learn the initialization and the step size in OGA
with guarantees. We provide a regret analysis of the strategy in the case of
convex losses. It suggests that, when there are parameters
$\theta_1,\dots,\theta_T$ solving well tasks $1,\dots,T$ respectively and that
are close enough one to each other, our strategy indeed improves on learning
each task in isolation.
</p>
"
Gapped Indexing for Consecutive Occurrences. (arXiv:2102.02505v1 [cs.DS]),http://arxiv.org/abs/2102.02505,"<p>The classic string indexing problem is to preprocess a string S into a
compact data structure that supports efficient pattern matching queries.
Typical queries include existential queries (decide if the pattern occurs in
S), reporting queries (return all positions where the pattern occurs), and
counting queries (return the number of occurrences of the pattern). In this
paper we consider a variant of string indexing, where the goal is to compactly
represent the string such that given two patterns P1 and P2 and a gap range
[\alpha,\beta] we can quickly find the consecutive occurrences of P1 and P2
with distance in [\alpha,\beta], i.e., pairs of occurrences immediately
following each other and with distance within the range. We present data
structures that use \~O(n) space and query time \~O(|P1|+|P2|+n^(2/3)) for
existence and counting and \~O(|P1|+|P2|+n^(2/3)*occ^(1/3)) for reporting. We
complement this with a conditional lower bound based on the set intersection
problem showing that any solution using \~O(n) space must use
\tilde{\Omega}}(|P1|+|P2|+\sqrt{n}) query time. To obtain our results we
develop new techniques and ideas of independent interest including a new suffix
tree decomposition and hardness of a variant of the set intersection problem.
</p>
"
Aitken-Schwarz heterogeneous Domain Decomposition for EMT-TS Simulation. (arXiv:2102.02507v1 [math.NA]),http://arxiv.org/abs/2102.02507,"<p>In this paper, a Schwarz heterogeneous domain decomposition method (DDM) is
used to co-simulate an RLC electrical circuit where a part of the domain is
modeled with Electro-Magnetic Transients (EMT) modeling and the other part with
dynamic phasor (TS) modeling. Domain partitioning is not based on cutting at
transmission lines which introduces a physical delay on the dynamics of the
solution, as is usually done, but only on connectivity considerations. We show
the convergence property of the homogeneous DDM EMT-EMT and TS-TS and of the
heterogeneous DDM TS-EMT, with and without overlap and we use the pure linear
divergence/convergence of the method to accelerate it toward the searched
solution with the Aitken's acceleration of the convergence technique.
</p>
"
An Analysis of International Use of Robots for COVID-19. (arXiv:2102.02509v1 [cs.RO]),http://arxiv.org/abs/2102.02509,"<p>This article analyses data collected on 338 instances of robots used
explicitly in response to COVID-19 from 24 Jan, 2020, to 23 Jan, 2021, in 48
countries. The analysis was guided by four overarching questions: 1) What were
robots used for in the COVID-19 response? 2) When were they used? 3) How did
different countries innovate? and 4) Did having a national policy on robotics
influence a country's innovation and insertion of robotics for COVID-19? The
findings indicate that robots were used for six different sociotechnical work
domains and 29 discrete use cases. When robots were used varied greatly on the
country; although many countries did report an increase at the beginning of
their first surge. To understand the findings of how innovation occurred, the
data was examined through the lens of the technology's maturity according to
NASA's Technical Readiness Assessment metrics. Through this lens, findings note
that existing robots were used for more than 78% of the instances; slightly
modified robots made up 10%; and truly novel robots or novel use cases
constituted 12% of the instances. The findings clearly indicate that countries
with a national robotics initiative were more likely to use robotics more often
and for broader purposes. Finally, the dataset and analysis produces a broad
set of implications that warrant further study and investigation. The results
from this analysis are expected to be of value to the robotics and robotics
policy community in preparing robots for rapid insertion into future disasters.
</p>
"
User Interface Factors of Mobile UX: A Study with an Incident Reporting Application. (arXiv:2102.02510v1 [cs.HC]),http://arxiv.org/abs/2102.02510,"<p>Smartphones are now ubiquitous, yet our understanding of user interface
factors that maximize mobile user experience (UX), is still limited. This work
presents a controlled experiment, which investigated factors that affect the
usability and UX of a mobile incident reporting app. The results indicate that
sequence of user interface elements matters while striving to increase UX, and
that there is no difference between tab and scrolling as navigation modalities
in short forms. These findings can serve as building blocks for
empirically-derived guidelines for mobile incident reporting.
</p>
"
High-Rate Quantum Private Information Retrieval with Weakly Self-Dual Star Product Codes. (arXiv:2102.02511v1 [cs.IT]),http://arxiv.org/abs/2102.02511,"<p>In the classical private information retrieval (PIR) setup, a user wants to
retrieve a file from a database or a distributed storage system (DSS) without
revealing the file identity to the servers holding the data. In the quantum PIR
(QPIR) setting, a user privately retrieves a classical file by receiving
quantum information from the servers. The QPIR problem has been treated by Song
et al. in the case of replicated servers, both with and without collusion. QPIR
over $[n,k]$ maximum distance separable (MDS) coded servers was recently
considered by Allaix et al., but the collusion was essentially restricted to
$t=n-k$ servers. In this paper, the QPIR setting is extended to account for
more flexible collusion of servers satisfying $t &lt; n-k+1$. Similarly to the
previous cases, the rates achieved are better than those known or conjectured
in the classical counterparts, as well as those of the previously proposed
coded and colluding QPIR schemes. This is enabled by considering the stabilizer
formalism and weakly self-dual generalized Reed--Solomon (GRS) star product
codes.
</p>
"
FedAUX: Leveraging Unlabeled Auxiliary Data in Federated Learning. (arXiv:2102.02514v1 [cs.LG]),http://arxiv.org/abs/2102.02514,"<p>Federated Distillation (FD) is a popular novel algorithmic paradigm for
Federated Learning, which achieves training performance competitive to prior
parameter averaging based methods, while additionally allowing the clients to
train different model architectures, by distilling the client predictions on an
unlabeled auxiliary set of data into a student model. In this work we propose
FedAUX, an extension to FD, which, under the same set of assumptions,
drastically improves performance by deriving maximum utility from the unlabeled
auxiliary data. FedAUX modifies the FD training procedure in two ways: First,
unsupervised pre-training on the auxiliary data is performed to find a model
initialization for the distributed training. Second, $(\varepsilon,
\delta)$-differentially private certainty scoring is used to weight the
ensemble predictions on the auxiliary data according to the certainty of each
client model. Experiments on large-scale convolutional neural networks and
transformer models demonstrate, that the training performance of FedAUX exceeds
SOTA FL baseline methods by a substantial margin in both the iid and non-iid
regime, further closing the gap to centralized training performance. Code is
available at github.com/fedl-repo/fedaux.
</p>
"
HYDRA: Hypergradient Data Relevance Analysis for Interpreting Deep Neural Networks. (arXiv:2102.02515v1 [cs.LG]),http://arxiv.org/abs/2102.02515,"<p>The behaviors of deep neural networks (DNNs) are notoriously resistant to
human interpretations. In this paper, we propose Hypergradient Data Relevance
Analysis, or HYDRA, which interprets the predictions made by DNNs as effects of
their training data. Existing approaches generally estimate data contributions
around the final model parameters and ignore how the training data shape the
optimization trajectory. By unrolling the hypergradient of test loss w.r.t. the
weights of training data, HYDRA assesses the contribution of training data
toward test data points throughout the training trajectory. In order to
accelerate computation, we remove the Hessian from the calculation and prove
that, under moderate conditions, the approximation error is bounded.
Corroborating this theoretical claim, empirical results indicate the error is
indeed small. In addition, we quantitatively demonstrate that HYDRA outperforms
influence functions in accurately estimating data contribution and detecting
noisy data labels. The source code is available at
https://github.com/cyyever/aaai_hydra_8686.
</p>
"
Non-Symmetric Coded Caching for Location-Dependent Content Delivery. (arXiv:2102.02518v1 [cs.IT]),http://arxiv.org/abs/2102.02518,"<p>Immersive viewing is emerging as the next interface evolution for
human-computer interaction. A truly wireless immersive application necessitates
immense data delivery with ultra-low latency, raising stringent requirements
for next-generation wireless networks. A potential solution for addressing
these requirements is through the efficient usage of in-device storage and
computation capabilities. This paper proposes a novel location-based coded
cache placement and delivery scheme, which leverages the nested code modulation
(NCM) to enable multi-rate multicasting transmission. To provide a uniform
quality of experience in different network locations, we formulate a linear
programming cache allocation problem. Next, based on the users' spatial
realizations, we adopt an NCM based coded delivery algorithm to efficiently
serve a distinct group of users during each transmission. Numerical results
demonstrate that the proposed location-based delivery method significantly
increases transmission efficiency compared to state of the art.
</p>
"
"Koopman Operator Dynamical Models: Learning, Analysis and Control. (arXiv:2102.02522v1 [eess.SY])",http://arxiv.org/abs/2102.02522,"<p>The Koopman operator allows for handling nonlinear systems through a
(globally) linear representation. In general, the operator is
infinite-dimensional - necessitating finite approximations - for which there is
no overarching framework. Although there are principled ways of learning such
finite approximations, they are in many instances overlooked in favor of, often
ill-posed and unstructured methods. Also, Koopman operator theory has
long-standing connections to known system-theoretic and dynamical system
notions that are not universally recognized. Given the former and latter
realities, this work aims to bridge the gap between various concepts regarding
both theory and tractable realizations. Firstly, we review data-driven
representations (both unstructured and structured) for Koopman operator
dynamical models, categorizing various existing methodologies and highlighting
their differences. Furthermore, we provide concise insight into the paradigm's
relation to system-theoretic notions and analyze the prospect of using the
paradigm for modeling control systems. Additionally, we outline the current
challenges and comment on future perspectives.
</p>
"
Efficient adaptive step size control for exponential integrators. (arXiv:2102.02524v1 [math.NA]),http://arxiv.org/abs/2102.02524,"<p>Traditional step size controllers make the tacit assumption that the cost of
a time step is independent of the step size. This is reasonable for explicit
and implicit integrators that use direct solvers. In the context of exponential
integrators, however, an iterative approach, such as Krylov methods or
polynomial interpolation, to compute the action of the required matrix
functions is usually employed. In this case, the assumption of constant cost is
not valid. This is, in particular, a problem for higher-order exponential
integrators, which are able to take relatively large time steps based on
accuracy considerations. In this paper, we consider an adaptive step size
controller for exponential Rosenbrock methods that determines the step size
based on the premise of minimizing computational cost. The largest allowed step
size, given by accuracy considerations, merely acts as a constraint. We test
this approach on a range of nonlinear partial differential equations. Our
results show significant improvements (up to a factor of 4 reduction in the
computational cost) over the traditional step size controller for a wide range
of tolerances.
</p>
"
Improved Communication Efficiency for Distributed Mean Estimation with Side Information. (arXiv:2102.02525v1 [cs.IT]),http://arxiv.org/abs/2102.02525,"<p>In this paper, we consider the distributed mean estimation problem where the
server has access to some side information, e.g., its local computed mean
estimation or the received information sent by the distributed clients at the
previous iterations. We propose a practical and efficient estimator based on an
r-bit Wynzer-Ziv estimator proposed by Mayekar et al., which requires no
probabilistic assumption on the data. Unlike Mayekar's work which only utilizes
side information at the server, our scheme jointly exploits the correlation
between clients' data and server' s side information, and also between data of
different clients. We derive an upper bound of the estimation error of the
proposed estimator. Based on this upper bound, we provide two algorithms on how
to choose input parameters for the estimator. Finally, parameter regions in
which our estimator is better than the previous one are characterized.
</p>
"
Deep Learning for Short-Term Voltage Stability Assessment of Power Systems. (arXiv:2102.02526v1 [eess.SP]),http://arxiv.org/abs/2102.02526,"<p>To fully learn the latent temporal dependencies from post-disturbance system
dynamic trajectories, deep learning is utilized for short-term voltage
stability (STVS) assessment of power systems in this paper. First of all, a
semi-supervised cluster algorithm is performed to obtain class labels of STVS
instances due to the unavailability of reliable quantitative criteria.
Secondly, a long short-term memory (LSTM) based assessment model is built
through learning the time dependencies from the post-disturbance system
dynamics. Finally, the trained assessment model is employed to determine the
systems stability status in real time. The test results on the IEEE 39-bus
system suggest that the proposed approach manages to assess the stability
status of the system accurately and timely. Furthermore, the superiority of the
proposed method over traditional shallow learning-based assessment methods has
also been proved.
</p>
"
FuzzSplore: Visualizing Feedback-Driven Fuzzing Techniques. (arXiv:2102.02527v1 [cs.CR]),http://arxiv.org/abs/2102.02527,"<p>Fuzz Testing techniques are the state of the art in software testing for
security issues nowadays. Their great effectiveness attracted the attention of
researchers and hackers and involved them in developing a lot of new techniques
to improve Fuzz Testing. The evaluation and the cross-comparison of these
techniques is an almost open problem. In this paper, we propose a human-driven
approach to this problem based on information visualization. We developed a
prototype upon the AFL++ fuzzing framework, FuzzSplore, that an analyst can use
to get useful insights about different fuzzing configurations applied to a
specific target in order to choose or tune the best technique during a fuzzing
campaign.
</p>
"
On the Global Optimality of Whittle's index policy for minimizing the age of information. (arXiv:2102.02528v1 [cs.IT]),http://arxiv.org/abs/2102.02528,"<p>This paper examines the average age minimization problem where only a
fraction of the network users can transmit simultaneously over unreliable
channels. Finding the optimal scheduling scheme, in this case, is known to be
challenging. Accordingly, the Whittle's index policy was proposed in the
literature as a low-complexity heuristic to the problem. Although simple to
implement, characterizing this policy's performance is recognized to be a
notoriously tricky task. In the sequel, we provide a new mathematical approach
to establish its optimality in the many-users regime for specific network
settings. Our novel approach is based on intricate techniques, and unlike
previous works in the literature, it is free of any mathematical assumptions.
These findings showcase that the Whittle's index policy has analytically
provable asymptotic optimality for the AoI minimization problem. Finally, we
lay out numerical results that corroborate our theoretical findings and
demonstrate the policy's notable performance in the many-users regime.
</p>
"
ABCNet: Attentive Bilateral Contextual Network for Efficient Semantic Segmentation of Fine-Resolution Remote Sensing Images. (arXiv:2102.02531v1 [cs.CV]),http://arxiv.org/abs/2102.02531,"<p>Semantic segmentation of remotely sensed images plays a crucial role in
precision agriculture, environmental protection, and economic assessment. In
recent years, substantial fine-resolution remote sensing images are available
for semantic segmentation. However, due to the complicated information caused
by the increased spatial resolution, state-of-the-art deep learning algorithms
normally utilize complex network architectures for segmentation, which usually
incurs high computational complexity. Specifically, the high-caliber
performance of the convolutional neural network (CNN) heavily relies on
fine-grained spatial details (fine resolution) and sufficient contextual
information (large receptive fields), both of which trigger high computational
costs. This crucially impedes their practicability and availability in
real-world scenarios that require real-time processing. In this paper, we
propose an Attentive Bilateral Contextual Network (ABCNet), a convolutional
neural network (CNN) with double branches, with prominently lower computational
consumptions compared to the cutting-edge algorithms, while maintaining a
competitive accuracy. Code is available at https://github.com/lironui/ABCNet.
</p>
"
Deep Learning Based Model Identification System Exploits the Modular Structure of a Bio-Inspired Posture Control Model for Humans and Humanoids. (arXiv:2102.02536v1 [cs.LG]),http://arxiv.org/abs/2102.02536,"<p>This work presents a system identification procedure based on Convolutional
Neural Networks (CNN) for human posture control using the DEC (Disturbance
Estimation and Compensation) parametric model. The modular structure of the
proposed control model inspired the design of a modular identification
procedure, in the sense that the same neural network is used to identify the
parameters of the modules controlling different degrees of freedom. In this way
the presented examples of body sway induced by external stimuli provide several
training samples at once
</p>
"
